{
  "phase": "estimate",
  "design_source": "recommendation.json",
  "timestamp": "2026-07-19T18:30:00Z",
  "pricing_source": {
    "status": "cached",
    "message": "us-east-1 cache"
  },
  "current_costs": {
    "source": "user_provided",
    "vercel_monthly": 125,
    "baseline_note": "Q6 midpoint"
  },
  "projected_costs": {
    "aws_monthly_premium": 180.0,
    "aws_monthly_balanced": 140.0,
    "aws_monthly_optimized": 110.0,
    "aws_annual_optimized": 1320.0,
    "breakdown": {
      "total": {
        "premium": 180.0,
        "mid": 140.0,
        "low": 110.0
      },
      "OpenNext": {
        "premium": 100.0,
        "mid": 80.0,
        "low": 65.0,
        "pricing_source": "cached"
      },
      "RDS PostgreSQL": {
        "premium": 80.0,
        "mid": 60.0,
        "low": 45.0,
        "pricing_source": "cached"
      }
    }
  },
  "complexity_tier": "small",
  "recommendation": {
    "path": "migrate_optimized",
    "path_label": "Migrate Optimized",
    "migrate_if": [
      "want AWS ownership"
    ],
    "stay_if": [
      "preview DX critical"
    ]
  }
}
